{
  "schema_version": "1",
  "id": "TASK-0001",
  "project_id": "PRJ-EXAMPLE-001",
  "title": "Short task title",
  "objective": "What this task achieves.",
  "type": "implementation",
  "scope": "What is in and out of scope.",
  "inputs": [],
  "dependencies": [],
  "parent_task": null,
  "subtasks": [],
  "authorized_actions": ["READ", "ANALYZE", "WRITE_DOCS"],
  "restrictions": ["No production access.", "No destructive actions."],
  "acceptance_criteria": ["Observable criterion."],
  "verification": "How completion will be verified.",
  "evidence": [],
  "status": "PENDING",
  "related_requirements": ["REQ-0001"],
  "owner": "owner-name",
  "created_at": "1970-01-01T00:00:00Z",
  "updated_at": "1970-01-01T00:00:00Z",
  "metadata": {}
}
